{
  "surface_kind": "opl_connect_scientific_search_provider_profile.v1",
  "schema_ref": "contracts/scientific-search-adapters/scientific-search-provider-profile.schema.json",
  "profile_id": "mas-scholar-skills.scientific-search.v1",
  "profile_role": "optional_connector_profile",
  "registry_owner": "mas-scholar-skills.scientific-search-adapters",
  "provider_ontology_owner": "profile_not_framework_core",
  "provider_scope": {
    "role": "package_owned_primary_biomedical_and_generic_metadata_search",
    "provider_ids": [
      "crossref",
      "openalex",
      "pubmed",
      "pmc"
    ],
    "framework_core_provider_ids": []
  },
  "adapter_package": {
    "package_id": "mas-scholar-skills",
    "module_id": "mas-scholar-skills.scientific-search-adapters",
    "package_role": "capability_package_runtime_module",
    "adapter_abi": "opl-connect-scientific-search-adapter.v1",
    "registry_ref": "contracts/scientific-search-adapters/scientific-search-adapter-registry.json",
    "handler_ref": "runtime/scientific-search-adapters/index.ts#runScientificSearchAdapterStep",
    "adapter_ids": [
      "crossref_search_rest",
      "openalex_search_rest",
      "ncbi_pubmed_search",
      "europe_pmc_search"
    ],
    "byte_authority": "installed_capability_package_source_commit_and_content_digest"
  },
  "default_provider_ids": [
    "crossref",
    "openalex",
    "pubmed",
    "pmc"
  ],
  "providers": [
    {
      "provider_id": "crossref",
      "adapter_id": "crossref_search_rest",
      "source_provider": "Crossref",
      "endpoint": {
        "default_base_url": "https://api.crossref.org",
        "environment_override": "OPL_CONNECT_CROSSREF_API_BASE",
        "allowed_origins": [
          "https://api.crossref.org"
        ]
      }
    },
    {
      "provider_id": "openalex",
      "adapter_id": "openalex_search_rest",
      "source_provider": "OpenAlex",
      "endpoint": {
        "default_base_url": "https://api.openalex.org",
        "environment_override": "OPL_CONNECT_OPENALEX_API_BASE",
        "allowed_origins": [
          "https://api.openalex.org"
        ]
      }
    },
    {
      "provider_id": "pubmed",
      "adapter_id": "ncbi_pubmed_search",
      "source_provider": "PubMed",
      "endpoint": {
        "default_base_url": "https://eutils.ncbi.nlm.nih.gov/entrez/eutils",
        "environment_override": "OPL_CONNECT_PUBMED_EUTILS_BASE",
        "allowed_origins": [
          "https://eutils.ncbi.nlm.nih.gov"
        ]
      }
    },
    {
      "provider_id": "pmc",
      "adapter_id": "europe_pmc_search",
      "source_provider": "Europe PMC",
      "endpoint": {
        "default_base_url": "https://www.ebi.ac.uk/europepmc/webservices/rest",
        "environment_override": "OPL_CONNECT_EUROPE_PMC_API_BASE",
        "allowed_origins": [
          "https://www.ebi.ac.uk"
        ]
      }
    }
  ],
  "no_authority_boundary": {
    "can_perform_network_io": false,
    "can_read_environment": false,
    "can_write_files": false,
    "can_spawn_processes": false,
    "can_define_framework_core_identity": false,
    "can_write_domain_truth": false,
    "can_create_owner_receipt": false,
    "can_create_typed_blocker": false,
    "can_claim_reference_truth": false,
    "can_claim_quality_verdict": false,
    "can_claim_domain_ready": false,
    "can_claim_production_ready": false
  }
}
